{
  "$schema": "https://raw.githubusercontent.com/yehyakin/kin-design-system/main/adoption/kin.config.schema.json",
  "kinVersion": "3.0.0",
  "profile": "information-site",
  "contract": {
    "source": "https://github.com/yehyakin/kin-design-system/tree/075466252b7d359af647840d874f6ba7d489429a",
    "local": "docs/KIN-DESIGN.md",
    "revision": "075466252b7d359af647840d874f6ba7d489429a",
    "checksum": "2a53ed7a94b4dba26f7fc114ad72f274a28f4cc644022b07cba3342f1b847a10"
  },
  "tokens": {
    "source": "src/styles/tokens.css",
    "format": "css",
    "generated": false
  },
  "components": {
    "roots": ["src/components"]
  },
  "scope": {
    "mode": "partial",
    "implementationBrief": "docs/kin-implementation-brief.md",
    "routeProfiles": [
      {
        "route": "/records/**",
        "profile": "information-site",
        "purpose": "Search, open, verify, and return to a published record.",
        "representative": true
      }
    ],
    "exclusions": []
  },
  "delivery": {
    "mode": "contract-first",
    "figma": "variables-only",
    "runtime": "project-owned",
    "evidence": "docs/kin-evidence.json"
  },
  "audit": {
    "include": ["src"],
    "exclude": ["src/generated/**"],
    "exceptions": []
  },
  "verification": {
    "commands": ["npm run lint", "npm run typecheck", "npm test", "npm run build"]
  }
}
